{
  "schema": "epistates/review-evidence/v1",
  "task_id": "e1-contracts",
  "run_id": "run-001",
  "attempt_id": "attempt-001",
  "task_card_digest": "sha256:c14c033bd0e001a4db801f99e5ab60dc75dee7c4ca597305740124e95113d3c9",
  "adapter_digest": "sha256:5427ac8135d2d16e813e2104a17aad11bb2cd4e133b3e4fea6994a103bde56bd",
  "preflight_result_digest": "sha256:2b4748558d43146b20e81705d0a83da96b2635b1eb411c4269b8c7ac02385f2c",
  "dispatch_receipt_digest": "sha256:98bcf82f46f82ac75c211516baba41ce1e67a32ee27d24acb8953efaf97e9910",
  "human_notice_digest": "sha256:1564e4bed8df93c7b5cf0e3529876ca4a44efc60364467898ae58bf292e31b1c",
  "adapter_id": "opencode-tmux",
  "session_name": "epistates-opencode",
  "reviewed_at": "2026-08-11T18:45:00Z",
  "max_dispatch_age_seconds": 3600,
  "max_notice_age_seconds": 3600,
  "capture_digest": "sha256:aaaaaaaaaaaaaaaaaaaaaaaaaaaaaaaaaaaaaaaaaaaaaaaaaaaaaaaaaaaaaaaa",
  "capture_length_utf8": 1024,
  "capture_lines": 50,
  "checks": [
    {"check_id": "diff_check", "status": "pass", "digest": "sha256:bbbbbbbbbbbbbbbbbbbbbbbbbbbbbbbbbbbbbbbbbbbbbbbbbbbbbbbbbbbbbbbb", "length_utf8": 0},
    {"check_id": "git_status", "status": "pass", "digest": "sha256:cccccccccccccccccccccccccccccccccccccccccccccccccccccccccccccccc", "length_utf8": 0},
    {"check_id": "unit_tests", "status": "pass", "digest": "sha256:dddddddddddddddddddddddddddddddddddddddddddddddddddddddddddddddd", "length_utf8": 100}
  ],
  "phases_confirmed": ["capture_once", "checks_once"],
  "final_state": "REVIEWING",
  "confirms": "inspection_only"
}
